Patrón,Estado,N1 en Glosario,Adj1 en Glosario,N2 en Glosario,Adj2 en Glosario,N1+Adj1 en Glosario,N2+Adj2 en Glosario,Adj1 en Lista Específica,Adj2 en Lista Específica,Contexto
tiempo completo en un trabajo parcial,Segundo sustantivo en glosario,No,No,Sí,No,No,No,Sí,Sí,"hecho de rechazar esta conversión, sin perjuicio de las medidas que, de conformidad con lo dispuesto en los artículos 51 tiempo completo en un trabajo parcial y viceversa tendrá siempre carácter voluntario para el trabajador y no se podrá imponer de forma unilateral o como consecuencia de una modificación sustancial de condiciones de trabajo al amparo de lo dispuesto en el artículo 41"
tiempo parcial a la formación profesional,Combinación N+ADJ encontrada,No,No,No,No,No,Sí,Sí,Sí,"pero constituirá, en todo caso, un pacto específico respecto al contrato. El pacto se formalizará necesariamente por escrito. b) Solo tiempo parcial a la formación profesional continua, a fin de favorecer su progresión y movilidad profesionales"
regla previsto en las letra anterior,Parcialmente encontrado,Sí,No,No,No,No,No,No,No,de los porcentajes de horas complementarias pactadas que se establecen en la letra c). h) La realización de horas complementarias regla previsto en las letra anterior ial y contrato de relevo
término establecido en el texto refundir,Parcialmente encontrado,Sí,No,No,No,No,No,No,No,el texto refundido de la Ley General de la Seguridad Social. La ejecución de este contrato de trabajo a tiempo término establecido en el texto refundir y contrato de relevo
requisito establecido en el texto refundir,Parcialmente encontrado,Sí,No,No,No,No,No,No,No,"que se hubiera celebrado por duración determinada podrá prorrogarse mediante acuerdo con las partes por periodos anuales, extinguiéndose en todo requisito establecido en el texto refundir contrato de relevo"
jornada acordado por el trabajador sustituir,Segundo sustantivo en glosario,No,No,Sí,No,No,No,No,No,jornada acordado por el trabajador sustituir ntrato de relevo
término previsto en el texto refundir,Parcialmente encontrado,Sí,No,No,No,No,No,No,No,término previsto en el texto refundir al y contrato de relevo
