Patrón N+ADJ+PREP+NOUN,Estado,Noun en Glosario,Adj1 en Glosario,N2 en Glosario,N1+Adj1 en Glosario,Adj1 en Lista Específica,Contexto
día señalado para el pago,Encontrado en glosario,Sí,No,Sí,Sí,No,"tendrán derecho a percibir, sin que llegue el día señalado para el pago, anticipos a cuenta del trabajo ya realizado. día señalado para el pago , anticipos a cuenta del trabajo ya realizado"
garantía establecido en el artículo,Encontrado en glosario,Sí,No,Sí,Sí,No,"2. El derecho al salario a comisión nacerá en el momento de realizarse y pagarse el negocio, la colocación o garantía establecido en el artículo"
libro referente a tal devengo,Encontrado en glosario,Sí,No,Sí,Sí,No,"salario será el diez por ciento de lo adeudado. 4. El salario, así como el pago delegado de las prestaciones libro referente a tal devengo ago"
pago delegado de el prestación,Encontrado en glosario,Sí,Sí,Sí,Sí,No,"u otra modalidad de pago similar a través de entidades de crédito, previo informe al comité de empresa o delegados pago delegado de el prestación go"
pago similar a  través,Encontrado en glosario,Sí,No,No,Sí,No,pago similar a  través ión y pago
