Patrón N+ADJ+ADJ,Estado,Patrón en Glosario,Noun en Glosario,Adj1 en Glosario,Adj2 en Glosario,N1+Adj1 en Glosario,Adj1 en Lista Específica,Adj2 en Lista Específica,Contexto
límites mínimos establecidos,No encontrado,No,No,No,No,No,No,No,"de la ejecutividad del traslado en el plazo de incorporación citado, el trabajador que, no límites mínimos establecidos la extinción de su contrato, se muestre disconforme con la decisión empresarial podrá impugnarla ante"
acción individual prevista,Parcialmente encontrado,No,Sí,Sí,No,No,No,No,aplicación del procedimiento de mediación o arbitraje que sea de aplicación en el ámbito de acción individual prevista deberá desarrollarse dentro del plazo máximo señalado para dicho periodo. 3. Si por traslado uno
acciones individuales iniciadas,Parcialmente encontrado,No,Sí,Sí,No,No,No,No,"que deberá desarrollarse dentro del plazo máximo señalado para dicho periodo. 3. Si por traslado acciones individuales iniciadas cónyuges cambia de residencia, el otro, si fuera trabajador de la misma empresa, tendrá derecho"
plazo máximo señalado,Parcialmente encontrado,No,Sí,No,No,No,No,No,"social integral, tendrán derecho preferente a ocupar otro puesto de trabajo, del mismo grupo profesional plazo máximo señalado que la empresa tenga vacante en cualquier otro de sus centros de trabajo. En tales"
asistencia social integral,Parcialmente encontrado,No,No,Sí,No,Sí,Sí,No,"podrán optar entre el regreso a su puesto de trabajo anterior o la continuidad en asistencia social integral en este caso la obligación de reserva, o la extinción de su contrato, percibiendo una"
orientación psicológica relacionado,No encontrado,No,No,No,No,No,No,No,trabajador deberá ser informado del desplazamiento con una antelación suficiente a la fecha de su orientación psicológica relacionado podrá ser inferior a cinco días laborables en el caso de desplazamientos de duración superior
